{
  "schema_version": 4,
  "id": "drum_bridge",
  "name": "Drum bridge",
  "description": "The new track's drums join the old track; on bar 8 the old track drops to drums while the new one brings in its bass and melody, then its vocals on bar 12.",
  "bars": 16,
  "requires": {
    "stems": "both",
    "beatmatchable": true,
    "max_camelot_distance": 1
  },
  "events": [
    {
      "at_bar": 0,
      "deck": "in",
      "command": "play"
    },
    {
      "at_bar": 16,
      "deck": "out",
      "command": "pause"
    }
  ],
  "lanes": [
    {
      "deck": "in",
      "control": "volume",
      "points": [
        [
          0,
          0.8
        ]
      ]
    },
    {
      "deck": "in",
      "control": "stem.drums",
      "points": [
        [
          0,
          1
        ]
      ]
    },
    {
      "deck": "in",
      "control": "stem.bass",
      "points": [
        [
          0,
          0
        ],
        [
          8,
          0
        ],
        [
          8,
          1
        ]
      ]
    },
    {
      "deck": "in",
      "control": "stem.other",
      "points": [
        [
          0,
          0
        ],
        [
          8,
          0
        ],
        [
          8,
          1
        ]
      ]
    },
    {
      "deck": "in",
      "control": "stem.vocals",
      "points": [
        [
          0,
          0
        ],
        [
          12,
          0
        ],
        [
          12,
          1
        ]
      ]
    },
    {
      "deck": "out",
      "control": "stem.vocals",
      "points": [
        [
          0,
          1
        ],
        [
          4,
          1
        ],
        [
          4,
          0
        ]
      ]
    },
    {
      "deck": "out",
      "control": "stem.bass",
      "points": [
        [
          0,
          1
        ],
        [
          8,
          1
        ],
        [
          8,
          0
        ]
      ]
    },
    {
      "deck": "out",
      "control": "stem.other",
      "points": [
        [
          0,
          1
        ],
        [
          8,
          1
        ],
        [
          8,
          0
        ]
      ]
    },
    {
      "deck": null,
      "control": "xfader",
      "points": [
        [
          0,
          0
        ],
        [
          4,
          0.5
        ],
        [
          12,
          0.5
        ],
        [
          16,
          1
        ]
      ]
    }
  ]
}
